{
  "id": "011-graph-shortest-path",
  "title": "Shortest Path in Weighted Graph",
  "description": "Given a weighted directed graph as an adjacency list and two node IDs (start, end), find the shortest path distance. Return -1 if no path exists.\n\nGraph format: {node: [[neighbor, weight], ...]}\n\nExample:\n  Input: graph={\"A\": [[\"B\", 1], [\"C\", 4]], \"B\": [[\"C\", 2]], \"C\": []}, start=\"A\", end=\"C\"\n  Output: 3  (A→B→C = 1+2)",
  "difficulty": "medium",
  "category": "algorithms",
  "languages": ["python", "javascript"],
  "constraints": { "time_limit_ms": 5000, "memory_limit_mb": 256, "max_output_bytes": 1048576 },
  "function_signature": {
    "python": { "name": "shortest_path", "params": "graph: dict, start: str, end: str", "returns": "int" },
    "javascript": { "name": "shortestPath", "params": "graph: object, start: string, end: string", "returns": "number" }
  },
  "tests": [
    { "input": [{"A": [["B", 1], ["C", 4]], "B": [["C", 2]], "C": []}, "A", "C"], "expected_output": 3 },
    { "input": [{"X": [["Y", 5]], "Y": [], "Z": []}, "X", "Z"], "expected_output": -1, "description": "No path" },
    { "input": [{"A": [["A", 0]]}, "A", "A"], "expected_output": 0, "description": "Same node" },
    { "input": [{"1": [["2", 1], ["3", 10]], "2": [["3", 1]], "3": [["4", 1]], "4": []}, "1", "4"], "expected_output": 3, "is_hidden": true }
  ],
  "hints": ["Dijkstra's algorithm with a priority queue", "Use heapq in Python or a sorted array in JS"],
  "tags": ["graph", "dijkstra", "shortest-path", "priority-queue"],
  "author": "Claudius",
  "created_at": "2026-03-02T23:30:00Z",
  "elo_weight": 1.0
}
