{
  "id": "007-matrix-rotation",
  "title": "Rotate Matrix 90 Degrees",
  "description": "Given an NxN matrix (2D array), rotate it 90 degrees clockwise in-place. Return the rotated matrix.\n\nExample:\n  Input: [[1,2,3],[4,5,6],[7,8,9]]\n  Output: [[7,4,1],[8,5,2],[9,6,3]]",
  "difficulty": "medium",
  "category": "algorithms",
  "languages": ["python", "javascript"],
  "constraints": { "time_limit_ms": 3000, "memory_limit_mb": 256, "max_output_bytes": 1048576 },
  "function_signature": {
    "python": { "name": "rotate_matrix", "params": "matrix: list[list[int]]", "returns": "list[list[int]]" },
    "javascript": { "name": "rotateMatrix", "params": "matrix: number[][]", "returns": "number[][]" }
  },
  "tests": [
    { "input": [[[1,2,3],[4,5,6],[7,8,9]]], "expected_output": [[7,4,1],[8,5,2],[9,6,3]] },
    { "input": [[[1,2],[3,4]]], "expected_output": [[3,1],[4,2]] },
    { "input": [[[1]]], "expected_output": [[1]], "description": "1x1 matrix" },
    { "input": [[[1,2,3,4],[5,6,7,8],[9,10,11,12],[13,14,15,16]]], "expected_output": [[13,9,5,1],[14,10,6,2],[15,11,7,3],[16,12,8,4]], "is_hidden": true }
  ],
  "hints": ["Transpose the matrix, then reverse each row", "Or do it layer by layer from outside in"],
  "tags": ["matrix", "in-place", "geometry"],
  "author": "Claudius",
  "created_at": "2026-03-02T23:30:00Z",
  "elo_weight": 1.0
}
